,caption,video_id,video,frame,results_st,results_lt
212,a man is jumping on a trampoline and then falls,202000823938_10032,202000823938,10032,0.830108871483237,0.7799535146835771
213,a group of people standing on a tennis court,202000823938_10214,202000823938,10214,0.8295455627907293,0.7794858651776376
214,a tennis player is jumping to hit the ball,202000823938_10452,202000823938,10452,0.8296203750377426,0.7793126151876713
215,a tennis player is jumping up and down,202000823938_10570,202000823938,10570,0.8294221042958257,0.7791584631529281
216,a group of people are playing a game of soccer,202000823938_10709,202000823938,10709,0.8292830621876434,0.7790900795989801
217,a man is dancing and singing on stage,202000823938_10805,202000823938,10805,0.8295979608989709,0.7798719728721404
218,a man is holding a sign and a woman is holding a microphone,202000823938_10898,202000823938,10898,0.8298783471917116,0.7799231992100034
219,a man is playing a piano on stage,202000823938_11144,202000823938,11144,0.8295669100177037,0.7795999152129771
220,a man is holding a tennis racket in his hand,202000823938_11398,202000823938,11398,0.8298555162634089,0.7798000313250981
221,a man and a woman are standing in the snow,202000823938_11741,202000823938,11741,0.8297614950351939,0.7799638267683814
222,a man wearing a winter hat and holding a cell phone,202000823938_12258,202000823938,12258,0.8299215992837429,0.7800198252691509
223,a man and a woman are standing in the snow,202000823938_12620,202000823938,12620,0.8297614950351939,0.7799638267683814
224,a man wearing a hat and holding a cell phone,202000823938_12813,202000823938,12813,0.8299407637946291,0.7800390989039241
225,a man and a woman are standing in the snow,202000823938_13074,202000823938,13074,0.8297614950351939,0.7799638267683814
226,a man wearing a hat and holding a cell phone,202000823938_13387,202000823938,13387,0.8299407637946291,0.7800390989039241
227,a man and a woman are standing in the snow,202000823938_13626,202000823938,13626,0.8297614950351939,0.7799638267683814
228,a woman is smiling and laughing while wearing a black dress,202000823938_13884,202000823938,13884,0.8297838545001034,0.7802478210324606
229,a laptop computer sitting on top of a desk,202000823938_14193,202000823938,14193,0.8301921158771518,0.7798414372475685
230,a man is playing a guitar on stage,202000823938_14341,202000823938,14341,0.8295607875910571,0.7796174777602515
231,a man is dancing and singing in a room,202000824011_14,202000824011,14,0.8297842097136309,0.780053863657231
232,a snowboarder is jumping in the air with a white board,202000824011_146,202000824011,146,0.8299617637863236,0.7799164910750986
233,a man in a suit is standing in front of a tv,202000824011_400,202000824011,400,0.8298520920916136,0.7797774967958293
234,a sign for a library with a keyboard and a guitar,202000824011_587,202000824011,587,0.8301045259699446,0.7799199435246479
235,a man is standing in front of a tv,202000824011_686,202000824011,686,0.8298574170092173,0.7796858664729703
236,a sign for a <unk> <unk> is shown,202000824011_770,202000824011,770,0.8302907047050105,0.7801067201559535
237,a snowboarder is in mid air while performing a stunt,202000824011_914,202000824011,914,0.8300607855346352,0.7798505492859985
238,a group of people standing on a sidewalk holding a surfboard,202000824011_1256,202000824011,1256,0.8300276863683118,0.7800501515932582
239,a building with a clock built into it,202000824011_1534,202000824011,1534,0.830187528362502,0.779945143799776
240,a man is walking in the snow with a jacket on,202000824011_1657,202000824011,1657,0.8299076610814575,0.7802198456547114
241,a group of people standing on top of a field,202000824011_1880,202000824011,1880,0.8296178895293845,0.7794591911088099
242,a man on a skateboard doing a trick,202000824011_2066,202000824011,2066,0.8299459493360574,0.7799641637046345
243,a man in a blue jacket holding a snowboard,202000824011_2252,202000824011,2252,0.829929917046188,0.7801739652737916
244,a parking lot full of snow and a parking lot,202000824011_2470,202000824011,2470,0.8300237332436168,0.7798642115507419
245,a man in a suit and tie holding a tennis racket,202000824011_2680,202000824011,2680,0.8297607291661553,0.7797980453465816
246,a man is standing in front of a sign,202000824011_2973,202000824011,2973,0.8297842576602033,0.7797091150018924
247,a large building with a clock on it,202000824011_3244,202000824011,3244,0.8302202609072097,0.7800134961595906
248,a group of people riding skis on a snowy surface,202000824011_3464,202000824011,3464,0.8299213893069267,0.7799915986628916
249,a group of people on skis in the snow,202000824011_3645,202000824011,3645,0.8297744239886987,0.779808811131998
250,a man holding a tennis racquet on a tennis court,202000824011_3844,202000824011,3844,0.8296443335245315,0.7796287100975084
251,a snow covered street with a parking meter and a car,202000824011_4045,202000824011,4045,0.8302044051982875,0.780136294965625
252,a sign with a <unk> on it and a message,202000824011_4152,202000824011,4152,0.8301546812820584,0.779934464701996
253,a sign that is sitting in the snow,202000824011_4221,202000824011,4221,0.829996530981704,0.7798590332386943
254,a bench sitting in front of a building with a sign on it,202000824011_4314,202000824011,4314,0.8299471825316451,0.7797530809053106
255,a group of people standing around a snow covered ski lift,202000824011_4445,202000824011,4445,0.8299290560066028,0.7798504569586152
256,a man in a suit and tie standing in front of a boat,202000824011_4678,202000824011,4678,0.8298358697266653,0.779892498942536
257,a group of people riding skis on top of a snow covered slope,202000824011_4872,202000824011,4872,0.8299235008271434,0.7799031253677424
258,a group of people standing on top of a snow covered slope,202000824011_5029,202000824011,5029,0.8299422638368542,0.7798512719305642
259,a group of people skiing down a snow covered slope,202000824011_5429,202000824011,5429,0.82998635260807,0.7799378995610285
260,a group of people on a field with a tennis racket,202000824011_5807,202000824011,5807,0.8296455716576379,0.7795088723481287
261,a group of people riding skis down a snow covered slope,202000824011_6015,202000824011,6015,0.8299624725822378,0.779985744748608
262,a group of people standing on top of a snow covered slope,202000824011_6236,202000824011,6236,0.8299422638368542,0.7798512719305642
263,a group of people riding skis down a snow covered slope,202000824011_6661,202000824011,6661,0.8299624725822378,0.779985744748608
264,a man is holding a microphone and a woman is holding a guitar,202000824011_7056,202000824011,7056,0.8299091923591442,0.7800524705674955
265,a skier is racing down a snowy slope,202000824011_7212,202000824011,7212,0.8300798165440822,0.7799985548779574
266,a skier is jumping a ramp in a competition,202000824011_7366,202000824011,7366,0.8300498309548927,0.7797611528746858
267,a man is playing a guitar and another man is playing a guitar,202000824011_7475,202000824011,7475,0.8296187969646295,0.7796889194210433
268,a man is dancing on a stage with a microphone,202000824011_7530,202000824011,7530,0.8297594789467468,0.7799006268897257
269,a man in a suit and tie standing in front of a television,202000824011_7618,202000824011,7618,0.829792968952684,0.7797237801260402
270,a man is jumping in the air with a tennis racket,202000824011_7932,202000824011,7932,0.8298856608561056,0.7797818742205878
271,a man is holding a baseball bat in front of a crowd,202000824011_8372,202000824011,8372,0.8296427481357284,0.7796697809688653
272,a man is dancing in front of a crowd of people,202000824011_8651,202000824011,8651,0.8296556768698891,0.7798272521602865
273,a man in a suit and tie standing in front of a crowd,202000824011_8788,202000824011,8788,0.8297051855888357,0.7797923832169138
274,a man is jumping on a trampoline and then falls,202000824011_8923,202000824011,8923,0.830108871483237,0.7799535146835771
275,a man is dancing in a room full of people,202000824011_9071,202000824011,9071,0.8298091626533947,0.7798750131797477
276,a man in a suit and tie holding a book,202000824011_9152,202000824011,9152,0.8297778230446022,0.7798458441123871
277,a sign for a <unk> <unk> <unk> <unk>,202000824011_9212,202000824011,9212,0.8304781456973656,0.7804473922710499
278,a basketball player is <unk> a goal in a game,202000824011_9462,202000824011,9462,0.8294524234749596,0.7790585083255888
279,a tennis player is jumping in the air as a crowd watches,202000824011_9731,202000824011,9731,0.829662600971797,0.7794272653276619
280,a man is dancing in front of a poster,202000824011_9799,202000824011,9799,0.8298344724191886,0.7799843336372881
281,a woman is dancing and singing on stage,202000824011_9857,202000824011,9857,0.8296249840059631,0.7799257244266847
282,a man is smiling and laughing at something,202000824011_9936,202000824011,9936,0.8299330376842695,0.7799994410522623
283,a man is dancing and singing on stage,202000824011_9993,202000824011,9993,0.8295979608989709,0.7798719728721404
284,a man riding a skateboard up the side of a ramp,202000824011_10488,202000824011,10488,0.8300116155573378,0.7800299516232385
285,two men in suits standing in front of a tv,202000824011_11019,202000824011,11019,0.8297663321020707,0.7796706530910137
286,a man is playing tennis on a court,202000824011_11338,202000824011,11338,0.8293631872359529,0.7793531162988304
287,a man is holding a microphone and a woman is holding a tennis racquet,202000824011_11782,202000824011,11782,0.8298724139245438,0.7799413954500083
288,a snowboarder is jumping in the air on a mountain,202000824011_12226,202000824011,12226,0.8301226393680687,0.7800499066747197
289,a man with a black hat is smiling and talking,202000824011_12589,202000824011,12589,0.8297336804244717,0.7800340292440046
290,a person on a snowboard in the air,202000824011_12921,202000824011,12921,0.8300620784773919,0.7799642767541349
291,a man is skiing down a hill,202000824011_13180,202000824011,13180,0.8297389524023578,0.779851955732393
292,a snowboarder is doing a jump on a mountain,202000824011_13270,202000824011,13270,0.8301406580510613,0.780043162190368
293,a person riding skis on a snowy surface,202000824011_13403,202000824011,13403,0.8300480587774712,0.7801421430047826
294,a man is smiling and waving his hands,202000824011_13586,202000824011,13586,0.8298737236853959,0.780065514292743
295,a person riding skis down a snow covered slope,202000824011_13784,202000824011,13784,0.8300748777061935,0.7801102227295155
296,a snowboarder is doing a trick in the air,202000824011_13942,202000824011,13942,0.8301127607716037,0.7799063883558041
297,a snowboarder is jumping over a snowy hill,202000824011_14037,202000824011,14037,0.8301106465245816,0.7801486524549851
298,a man is sitting in a room with a laptop,202000824011_14173,202000824011,14173,0.8301231757009141,0.7800811705344787
299,a man riding a skateboard up the side of a ramp,202000824011_14332,202000824011,14332,0.8300116155573378,0.7800299516232385
300,a man flying through the air while riding a snowboard,202000824011_14475,202000824011,14475,0.8299437999720998,0.7799859079506666
301,a person riding skis on a snowy surface,202000824011_14609,202000824011,14609,0.8300480587774712,0.7801421430047826
302,a man holding a cell phone in front of a laptop computer,202000824011_14835,202000824011,14835,0.830172831089217,0.7798840356706515
303,a tv screen showing a news <unk>,202000824011_15196,202000824011,15196,0.8301992469800713,0.7796936914977317
304,a man is dancing and singing in a room,202000824065_5,202000824065,5,0.8297842097136309,0.780053863657231
305,a pair of skis in the air with a pair of scissors,202000824065_129,202000824065,129,0.8300873491096933,0.7800247815182979
306,a man standing in front of a window holding a surfboard,202000824065_356,202000824065,356,0.8301237974266747,0.7800682526179045
307,a woman is dancing and singing on stage,202000824065_518,202000824065,518,0.8296249840059631,0.7799257244266847
308,a woman is holding up a book and a man is holding a microphone,202000824065_590,202000824065,590,0.829895418126185,0.7799763736598566
309,a man is dancing and singing on stage,202000824065_761,202000824065,761,0.8295979608989709,0.7798719728721404
310,a man is running on a field and <unk> a goal,202000824065_946,202000824065,946,0.829811225815054,0.7796023173695003
311,a tennis player is swinging a racket at a ball,202000824065_1017,202000824065,1017,0.829714073648652,0.7795095151923918
312,a man is dancing on stage with a microphone,202000824065_1060,202000824065,1060,0.8297594789467468,0.7799006268897257
313,a man in a suit and tie holding a microphone,202000824065_1449,202000824065,1449,0.8298700758087395,0.7799525777985187
314,a man in a white uniform is playing a game of tennis,202000824065_1876,202000824065,1876,0.8293960678993008,0.7794541119931041
315,a group of men playing soccer on a soccer field,202000824065_1942,202000824065,1942,0.8291225657363235,0.7790647133702663
316,a man is playing a game of tennis,202000824065_2011,202000824065,2011,0.8292956810637545,0.7791473928410811
317,a man is playing tennis on a court,202000824065_2078,202000824065,2078,0.8293631872359529,0.7793531162988304
318,a man is smiling and laughing at something,202000824065_2192,202000824065,2192,0.8299330376842695,0.7799994410522623
319,a hockey player is <unk> a goal in a game,202000824065_2377,202000824065,2377,0.8294566587910953,0.7790663467237853
320,a hockey player is <unk> a goal in a game,202000824065_2529,202000824065,2529,0.8294566587910953,0.7790663467237853
321,a hockey player is <unk> a goal in a game,202000824065_2627,202000824065,2627,0.8294566587910953,0.7790663467237853
322,a hockey player is <unk> a goal,202000824065_2679,202000824065,2679,0.8295010349101414,0.7791856109796299
323,a group of people playing a game of tennis,202000824065_2873,202000824065,2873,0.8293728578112699,0.7791775008166092
324,a group of people watching a man on a skateboard,202000824065_3116,202000824065,3116,0.8297934308380744,0.7797956125188336
325,a team of men are celebrating and one of them is holding a microphone,202000824065_3202,202000824065,3202,0.8296418173045718,0.7796036446991078
326,a man is riding a motorcycle and then falls,202000824065_3272,202000824065,3272,0.8298790173532247,0.7799570926885244
327,a white wall with a white wall clock and a white wall mounted clock,202000824065_3504,202000824065,3504,0.8300754089397409,0.7799795027157362
328,a man is standing in front of a tv,202000824065_3781,202000824065,3781,0.8298574170092173,0.7796858664729703
329,a man is riding a motorcycle on a track,202000824065_3979,202000824065,3979,0.8297865378904,0.7799117655879245
330,a man is riding a snowboard down a street,202000824065_4167,202000824065,4167,0.8298228875059439,0.7800055883969209
331,a car is driving down a snowy road,202000824065_4273,202000824065,4273,0.8301237831116417,0.7801290742256083
332,a man wearing a black shirt and a black tie is talking on a cell phone,202000824065_4456,202000824065,4456,0.8297891997675015,0.7800416023764165
333,a car is driving down a road with smoke coming from the back,202000824065_4710,202000824065,4710,0.8300985398610805,0.7798892109587011
334,a tv screen showing a picture of a man on a tv screen,202000824065_5160,202000824065,5160,0.8300667380708998,0.7796078725158003
335,a man in a suit and tie holding a remote,202000824117_5,202000824117,5,0.829870401405903,0.7799248963691479
336,a man is dancing and singing in a room,202000824117_28,202000824117,28,0.8297842097136309,0.780053863657231
337,a snowboarder is jumping in the air with a blue sky in the background,202000824117_164,202000824117,164,0.8300736416310949,0.78001048962634
338,a man is holding a tennis racket and a microphone,202000824117_504,202000824117,504,0.8298966054555443,0.7798784755233419
339,a group of people riding skis down a snow covered slope,202000824117_776,202000824117,776,0.8299624725822378,0.779985744748608
340,a man in a suit and tie standing in front of a sign,202000824117_1010,202000824117,1010,0.8297707616043305,0.7797518161449594
341,a person is walking in the snow with a snow board,202000824117_1265,202000824117,1265,0.8299827959353108,0.77997436269607
342,a sign with a <unk> on it and a message,202000824117_1365,202000824117,1365,0.8301546812820584,0.779934464701996
343,a sign that is sitting in the snow,202000824117_1434,202000824117,1434,0.829996530981704,0.7798590332386943
344,a bench sitting in front of a building with a sign on it,202000824117_1527,202000824117,1527,0.8299471825316451,0.7797530809053106
345,a group of people standing around a snow covered ski slope,202000824117_1647,202000824117,1647,0.8299588262730089,0.7799202754980654
346,a man is sitting in front of a tv,202000824117_1797,202000824117,1797,0.8299022852584571,0.7797709657155772
347,a group of people are playing football on a field,202000824117_2008,202000824117,2008,0.8293231049034789,0.7791422152140259
348,a group of people standing on top of a snow covered slope,202000824117_2184,202000824117,2184,0.8299422638368542,0.7798512719305642
349,a group of people riding skis down a snow covered slope,202000824117_2341,202000824117,2341,0.8299624725822378,0.779985744748608
350,a skier is jumping in the air while people watch,202000824117_2527,202000824117,2527,0.8299951371268831,0.779761340640061
351,a group of people riding skis on top of a snow covered slope,202000824117_2850,202000824117,2850,0.8299235008271434,0.7799031253677424
352,a man riding skis down a snow covered slope,202000824117_3192,202000824117,3192,0.8300092905416027,0.7801003800802744
353,a man is jumping in the air on a skateboard,202000824117_3440,202000824117,3440,0.8300379695366114,0.7799839330359088
354,a skier is jumping a ramp in the air,202000824117_3627,202000824117,3627,0.8301931766370517,0.7799456475036601
355,a man is jumping in the air with a skateboard,202000824117_3733,202000824117,3733,0.8300379695366114,0.7799839330359088
356,a group of people riding skis on top of a snow covered slope,202000824117_3854,202000824117,3854,0.8299235008271434,0.7799031253677424
357,a man in a suit and tie holding a baseball bat,202000824117_3937,202000824117,3937,0.8296527776963669,0.7797097837629695
358,a group of people riding skis down a snow covered slope,202000824117_3990,202000824117,3990,0.8299624725822378,0.779985744748608
359,a large blue and white bus driving down a snow covered mountain,202000824117_4058,202000824117,4058,0.8300229143753886,0.7801370529003759
360,a group of people riding skis on top of a snow covered slope,202000824117_4187,202000824117,4187,0.8299235008271434,0.7799031253677424
361,a man in a suit and tie standing in front of a microphone,202000824117_4355,202000824117,4355,0.829864709833741,0.7798939353430048
362,a man is smiling and laughing while holding a microphone,202000824117_4467,202000824117,4467,0.8300253771477227,0.7800897885247599
363,a man is standing in front of a poster,202000824117_4544,202000824117,4544,0.8298788106428981,0.7799001881784775
364,a man is holding a baseball bat in his hand,202000824117_4640,202000824117,4640,0.8297259745198621,0.7796941174327198
365,a hockey player is <unk> a goal in a game,202000824117_4700,202000824117,4700,0.8294566587910953,0.7790663467237853
366,a group of people standing on skis in a snow covered field,202000824117_4759,202000824117,4759,0.8298152024192895,0.7797604085618156
367,a group of people riding skis down a snow covered slope,202000824117_4915,202000824117,4915,0.8299624725822378,0.779985744748608
368,a man is standing in front of a tv,202000824117_5183,202000824117,5183,0.8298574170092173,0.7796858664729703
369,a man holding a tennis racquet in front of a crowd,202000824117_5393,202000824117,5393,0.8297605544362229,0.7797867883275424
370,a man on a motorcycle in the air,202000824117_5676,202000824117,5676,0.8298621461256646,0.7799689736658371
371,a man is wearing a helmet and holding a baseball bat,202000824117_5950,202000824117,5950,0.8296924690274422,0.779848728666488
372,a man in a suit and tie standing in front of a microphone,202000824117_6183,202000824117,6183,0.829864709833741,0.7798939353430048
373,a hockey player is <unk> a goal in a game,202000824117_6446,202000824117,6446,0.8294566587910953,0.7790663467237853
374,a hockey player is <unk> a goal,202000824117_6598,202000824117,6598,0.8295010349101414,0.7791856109796299
375,a man is running and then <unk> his arms,202000824117_6758,202000824117,6758,0.8301219989231271,0.7799910669897819
376,a group of men riding motorcycles in a parking lot,202000824117_6886,202000824117,6886,0.8297284050839118,0.7798408708552718
377,a man is holding a tennis racket and a ball,202000824117_6962,202000824117,6962,0.8297782165964346,0.7797070802769601
378,a hockey player is talking to a hockey player,202000824117_7030,202000824117,7030,0.8291450965695595,0.7788213620460149
379,a group of people watching a skier do a trick,202000824117_7124,202000824117,7124,0.8298009420168101,0.7796370324225568
380,a group of people riding skis down a snow covered slope,202000824117_7241,202000824117,7241,0.8299624725822378,0.779985744748608
381,a man is holding a tennis racket and playing a game,202000824117_7356,202000824117,7356,0.8295989280300853,0.7794524877801587
382,a man is dancing on a stage,202000824117_7856,202000824117,7856,0.8295439081618949,0.7797746550586533
383,a hockey player is <unk> a goal in a hockey game,202000824117_8358,202000824117,8358,0.8293716782350534,0.7789934039231448
384,a man is riding a snow board down a snowy slope,202000824117_8507,202000824117,8507,0.830004666994367,0.7800819393613376
385,a man is riding a skateboard and doing a jump,202000824117_8649,202000824117,8649,0.8299780190538097,0.7799799919574265
386,a group of people playing a game of tennis,202000824117_8753,202000824117,8753,0.8293728578112699,0.7791775008166092
387,a hockey player is <unk> a goal,202000824117_8966,202000824117,8966,0.8295010349101414,0.7791856109796299
388,a man riding a skateboard up the side of a ramp,202000824117_9207,202000824117,9207,0.8300116155573378,0.7800299516232385
389,a white clock with a picture of a man on it,202000824117_9708,202000824117,9708,0.8298719776809085,0.7799148732833088
390,a group of people on skis in the snow,202000824117_10203,202000824117,10203,0.8297744239886987,0.779808811131998
391,a group of people riding skis on a snowy surface,202000824117_10354,202000824117,10354,0.8299213893069267,0.7799915986628916
392,a hockey player is <unk> a goal in a hockey game,202000824117_10886,202000824117,10886,0.8293716782350534,0.7789934039231448
393,a man in a suit and tie standing in front of a microphone,202000824117_11512,202000824117,11512,0.829864709833741,0.7798939353430048
394,a man holding a tennis racquet on a tennis court,202000824117_11780,202000824117,11780,0.8296443335245315,0.7796287100975084
395,a man is jumping on a stage and <unk> a goal,202000824117_11976,202000824117,11976,0.8298482918367878,0.7797390797729107
396,a man is dancing and singing on stage,202000824117_12091,202000824117,12091,0.8295979608989709,0.7798719728721404
397,a man is jumping in the air with a tennis racquet,202000824117_12231,202000824117,12231,0.8298974866520955,0.7798163691517582
398,a man is playing a guitar and singing,202000824117_12426,202000824117,12426,0.8296276012219573,0.7798229740583154
399,a man in a suit is holding a baseball bat,202000824117_12600,202000824117,12600,0.8296519839443159,0.7797456567678915
400,a tennis player is jumping to hit the ball,202000824117_12742,202000824117,12742,0.8296203750377426,0.7793126151876713
401,a tennis player is hitting a tennis ball,202000824117_12843,202000824117,12843,0.8294235278437239,0.7791368017911354
402,a basketball player is jumping in the air as a crowd watches,202000824117_12991,202000824117,12991,0.8296200579330316,0.7793465537901135
403,a young boy holding a tennis racquet on a tennis court,202000824117_13156,202000824117,13156,0.8296473200124992,0.7796402316515151
404,a man is smiling and laughing while another man is sitting behind him,202000824117_13516,202000824117,13516,0.8298477523439413,0.7799084017388758
405,a man in a suit and tie standing in front of a microphone,202000824117_14056,202000824117,14056,0.829864709833741,0.7798939353430048
406,two men are sitting on a boat and one is smoking,202000824117_14309,202000824117,14309,0.8298306126885996,0.7798477934659088
407,a man in a hat is standing in the water,202000824117_14323,202000824117,14323,0.8299059008449967,0.7800415016224618
408,a man is standing next to a woman holding a surfboard,202000824117_14346,202000824117,14346,0.8299192024065333,0.7799670154694456
409,a shirtless man is swimming in the water,202000824117_14374,202000824117,14374,0.8299574603081561,0.7801747375636043
410,a man is smiling and talking to someone,202000824117_14405,202000824117,14405,0.8298695081056618,0.7799229613389097
411,a man is standing in the woods with a <unk>,202000824117_14433,202000824117,14433,0.8301049048334159,0.7802321505728488
412,a shirtless man is sitting on a boat,202000824117_14506,202000824117,14506,0.8299782859670796,0.7802233539996016
413,a man is riding a skateboard and jumps over a flight of stairs,202000824117_14582,202000824117,14582,0.8300826042361924,0.7800369212430794
414,a man is in the water with a woman and a man is holding a surfboard,202000824117_14640,202000824117,14640,0.8299667232004728,0.7801740464639144
415,a shirtless man is standing in the water,202000824117_14703,202000824117,14703,0.8299892470828673,0.7801601671512793
416,a man is holding a knife and cutting a piece of food,202000824117_14738,202000824117,14738,0.8302366430011315,0.7801798994354611
417,a person holding a surf board near a body of water,202000824117_14773,202000824117,14773,0.8301120883689825,0.7800539778802197
418,a person is skiing down a snowy hill,202000824117_14809,202000824117,14809,0.829956847410988,0.7800462094075195
