,caption,video_id,video,frame,results_st,results_lt
419,a man is dancing and singing in a room,202000824170_32,202000824170,32,0.8297842097136309,0.780053863657231
420,a pair of skis in the air with a pair of scissors,202000824170_183,202000824170,183,0.8300873491096933,0.7800247815182979
421,a man riding a skateboard up the side of a ramp,202000824170_499,202000824170,499,0.8300116155573378,0.7800299516232385
422,a train traveling down tracks next to a forest,202000824170_716,202000824170,716,0.829940295851748,0.7797799355232539
423,a person riding skis on a snowy surface,202000824170_791,202000824170,791,0.8300480587774712,0.7801421430047826
424,a person riding skis down a snow covered slope,202000824170_889,202000824170,889,0.8300748777061935,0.7801102227295155
425,a group of people on skis in the snow,202000824170_964,202000824170,964,0.8297744239886987,0.779808811131998
426,a group of people riding skis on top of a snow covered slope,202000824170_1063,202000824170,1063,0.8299235008271434,0.7799031253677424
427,a group of people riding skis down a snow covered slope,202000824170_1220,202000824170,1220,0.8299624725822378,0.779985744748608
428,a group of people riding skis down a snow covered slope,202000824170_1422,202000824170,1422,0.8299624725822378,0.779985744748608
429,a group of people riding skis on top of a snow covered slope,202000824170_1774,202000824170,1774,0.8299235008271434,0.7799031253677424
430,a race car is skidding off the track and into the grass,202000824170_2066,202000824170,2066,0.830143902105318,0.7799175764016579
431,a group of people riding skis on top of snow,202000824170_2223,202000824170,2223,0.8297628626544176,0.7797690683346318
432,a group of people riding skis down a snow covered slope,202000824170_2740,202000824170,2740,0.8299624725822378,0.779985744748608
433,a man is holding a microphone and a guitar,202000824170_3196,202000824170,3196,0.8299726032514287,0.78007247687052
434,a red and white sign and some signs on a street,202000824170_3263,202000824170,3263,0.829751430880981,0.7797993907923692
435,a group of people riding skis on top of a snow covered slope,202000824170_3323,202000824170,3323,0.8299235008271434,0.7799031253677424
436,a man is jumping and dancing in a circle,202000824170_3519,202000824170,3519,0.8298115810711293,0.7799687891941718
437,a person riding skis on a snowy surface,202000824170_3732,202000824170,3732,0.8300480587774712,0.7801421430047826
438,a man in a yellow shirt and a black hat is holding a snowboard,202000824170_3819,202000824170,3819,0.8298199824404344,0.7801757412545292
439,a group of people riding skis on top of a snow covered slope,202000824170_4080,202000824170,4080,0.8299235008271434,0.7799031253677424
440,a book shelf with a bunch of books on it,202000824170_4404,202000824170,4404,0.8301450198417432,0.7799620218718349
441,a group of people on skis at a train station,202000824170_4599,202000824170,4599,0.8298516874524652,0.7798282932817404
442,a man in a suit and tie sitting in front of a microphone,202000824170_4793,202000824170,4793,0.8298946220083966,0.7799506681806753
443,a hockey player is <unk> a goal in a game,202000824170_4965,202000824170,4965,0.8294566587910953,0.7790663467237853
444,a hockey player is <unk> a goal in a game,202000824170_5124,202000824170,5124,0.8294566587910953,0.7790663467237853
445,a baseball player is getting ready to hit a ball,202000824170_5310,202000824170,5310,0.8295978927655463,0.7792526702398264
446,a man is standing in front of a tv,202000824170_5481,202000824170,5481,0.8298574170092173,0.7796858664729703
447,a man in a suit and tie standing in front of a microphone,202000824170_5689,202000824170,5689,0.829864709833741,0.7798939353430048
448,a tv screen showing a picture of a man holding a cell phone,202000824170_6007,202000824170,6007,0.8301015511797816,0.7797557818556994
449,a person is playing a keyboard and singing,202000824275_3,202000824275,3,0.8298515078894266,0.7798346931656807
450,a man is dancing and singing in a room,202000824275_45,202000824275,45,0.8297842097136309,0.780053863657231
451,a kite flying in the sky with trees in the background,202000824275_284,202000824275,284,0.8302077392380114,0.7802022951916946
452,a man is riding a skateboard on a ramp,202000824275_810,202000824275,810,0.8300624754485849,0.7801466562813647
453,a basketball player is <unk> a goal in a game,202000824275_1265,202000824275,1265,0.8294524234749596,0.7790585083255888
454,a group of people standing around a tv,202000824275_1610,202000824275,1610,0.8298127845475369,0.7796123690631162
455,a group of people riding skis down a snow covered slope,202000824275_1845,202000824275,1845,0.8299624725822378,0.779985744748608
456,a skier skiing down a steep slope in the snow,202000824275_2135,202000824275,2135,0.8301654117627222,0.7799991528465146
457,a man is doing a trick on a skateboard,202000824275_2434,202000824275,2434,0.8299459493335072,0.7799641637027163
458,a man holding a snowboard in his right hand,202000824275_2534,202000824275,2534,0.829939736211631,0.7798645588951104
459,a group of people riding skis down a snow covered slope,202000824275_2683,202000824275,2683,0.8299624725822378,0.779985744748608
460,a man is holding a snowboard and a sign,202000824275_2827,202000824275,2827,0.8298573804651342,0.7798318431332357
461,a group of people riding skis down a snow covered slope,202000824275_2983,202000824275,2983,0.8299624725822378,0.779985744748608
462,a skier is skiing down a snowy hill,202000824275_3154,202000824275,3154,0.8299515579449522,0.780003919015986
463,a man holding a snowboard in front of a sign,202000824275_3316,202000824275,3316,0.8298815675212837,0.7798185125847904
464,a group of people on skis in the snow,202000824275_3469,202000824275,3469,0.8297744239886987,0.779808811131998
465,a man is looking at something and then looks away,202000824275_3632,202000824275,3632,0.829855539453302,0.7797040001132404
466,a sign that says <unk> <unk> <unk> <unk>,202000824275_3894,202000824275,3894,0.830377884252024,0.78031440373541
467,a man is looking at something and then looks away,202000824275_4109,202000824275,4109,0.829855539453302,0.7797040001132404
468,a skier is jumping a ramp in the air,202000824275_4415,202000824275,4415,0.8301931766370517,0.7799456475036601
469,a man in a black jacket and a black hat is holding a snowboard,202000824275_4713,202000824275,4713,0.8297739866266232,0.7801826387075504
470,a group of people riding skis on a snowy surface,202000824275_4836,202000824275,4836,0.8299213893069267,0.7799915986628916
471,a man with a baseball bat in his hand,202000824275_4950,202000824275,4950,0.8296645896869216,0.7796438475554768
472,a group of people riding skis on top of a snow covered slope,202000824275_5026,202000824275,5026,0.8299235008271434,0.7799031253677424
473,a man in a yellow jacket holding a snowboard,202000824275_5119,202000824275,5119,0.829954831213071,0.7802296496038147
474,a group of people riding skis down a snow covered slope,202000824275_5257,202000824275,5257,0.8299624725822378,0.779985744748608
475,a group of people on skis in the snow,202000824275_5436,202000824275,5436,0.8297744239886987,0.779808811131998
476,a tennis player is playing tennis on a court,202000824275_5721,202000824275,5721,0.8292176302692075,0.7790219670693544
477,a man is dancing in a parking lot,202000824275_5969,202000824275,5969,0.8297908310891866,0.7799331813332208
478,a car is driving on a road at night,202000824275_6059,202000824275,6059,0.8300239544125496,0.7799188105661137
479,a man wearing a hat and sunglasses is holding a gun,202000824275_6234,202000824275,6234,0.8299772999430106,0.7801672090053233
480,a car is driving down a road at night,202000824275_6409,202000824275,6409,0.8300239544125496,0.7799188105661137
481,a man wearing glasses is talking on a cell phone,202000824275_6545,202000824275,6545,0.8300874587691899,0.7800719891452209
482,a person is riding a snowboard down a snowy mountain,202000824275_6746,202000824275,6746,0.8300140542706055,0.7801908682307596
483,a man is walking down a street and then stops,202000824275_6944,202000824275,6944,0.8298366748624117,0.7799541307970992
484,a man is looking at a woman and then she looks away,202000824275_7082,202000824275,7082,0.8297775908569908,0.7797854316669823
485,a bed with a tv mounted on the wall,202000824275_7209,202000824275,7209,0.830434464609128,0.7800324967310321
486,a man in a suit and tie is holding a microphone,202000824275_7419,202000824275,7419,0.8298700758087395,0.7799525777985187
487,a man riding skis down a snow covered slope,202000824275_7630,202000824275,7630,0.8300092905416027,0.7801003800802744
488,a man is holding a cat in his arms,202000824275_8064,202000824275,8064,0.8300800018341169,0.7800363800429722
489,a man is wearing a mask and smiling,202000824275_8523,202000824275,8523,0.82981796020677,0.7801762666305715
490,a group of people riding skis down a snow covered slope,202000824275_8677,202000824275,8677,0.8299624725822378,0.779985744748608
491,a man is jumping over a wall with his skateboard,202000824275_8741,202000824275,8741,0.8300793845330827,0.7799957960244871
492,a group of people standing next to each other holding luggage,202000824275_8799,202000824275,8799,0.8299187216687656,0.7797832487887125
493,a snowboarder doing a trick on a rail,202000824275_8875,202000824275,8875,0.8301878147527976,0.7799586486174971
494,a view of a snowy mountain from a plane,202000824275_9284,202000824275,9284,0.8301342941244308,0.7801172037377652
495,a man is jumping and spinning on a stage,202000824275_9710,202000824275,9710,0.8299330701688039,0.7798299903544806
496,a person on skis jumping in the air,202000824275_9831,202000824275,9831,0.829999024060006,0.7799017386573148
497,a man wearing a yellow jacket is walking down a street,202000824275_9908,202000824275,9908,0.8298236851468912,0.7802693926399537
498,a person riding a skateboard down a ramp,202000824275_9994,202000824275,9994,0.8301608562024747,0.780161420266748
499,a person riding skis on a snowy surface,202000824275_10211,202000824275,10211,0.8300480587774712,0.7801421430047826
500,a man in a red jacket is on a snowboard,202000824275_10380,202000824275,10380,0.8298815408279511,0.780217823174759
501,a man is driving a car and then he <unk>,202000824275_10730,202000824275,10730,0.8301233846906436,0.7801788785018153
502,a man riding skis down a snow covered slope,202000824275_11097,202000824275,11097,0.8300092905416027,0.7801003800802744
503,a group of people riding skis down a snow covered slope,202000824275_11213,202000824275,11213,0.8299624725822378,0.779985744748608
504,a man riding a snowboard down a street,202000824275_11331,202000824275,11331,0.8298228875059439,0.7800055883969209
505,a man riding skis down a snow covered slope,202000824275_11481,202000824275,11481,0.8300092905416027,0.7801003800802744
506,a person on skis jumping in the air,202000824275_11693,202000824275,11693,0.829999024060006,0.7799017386573148
507,a snowboarder is doing a trick in the air,202000824275_11867,202000824275,11867,0.8301127607716037,0.7799063883558041
508,a snowboarder is jumping off a ramp in the snow,202000824275_11987,202000824275,11987,0.8302566659902265,0.7801187374556998
509,a person on skis is coming down a snowy hill,202000824275_12205,202000824275,12205,0.8299442548425254,0.7799637733792731
510,a person is holding a snowboard in the air,202000824275_12401,202000824275,12401,0.8300394373244945,0.7799470068192794
511,a person riding skis down a snow covered slope,202000824275_12524,202000824275,12524,0.8300748777061935,0.7801102227295155
512,a man riding a snowboard down a ramp,202000824275_12639,202000824275,12639,0.8300091279577597,0.780086993525818
513,a skier skiing down a snowy slope at a ski resort,202000824275_12770,202000824275,12770,0.8300104947416402,0.7800722113908459
514,a man in a suit and tie standing in front of a microphone,202000824275_13051,202000824275,13051,0.829864709833741,0.7798939353430048
515,a soccer player is <unk> a goal,202000824275_13282,202000824275,13282,0.8294473107814039,0.7791876037453521
516,a soccer player is running on the field,202000824275_13371,202000824275,13371,0.8292812172591679,0.7789241030705538
517,a man is swinging a baseball bat at a game,202000824275_13443,202000824275,13443,0.8295866042931507,0.7795124253915097
518,a tennis player is jumping to hit the ball,202000824275_13543,202000824275,13543,0.8296203750377426,0.7793126151876713
519,a man is sitting in a car and looking at something,202000824275_13726,202000824275,13726,0.8299344081440481,0.7798940384274362
520,a soccer player is kicking a ball into the net,202000824275_13958,202000824275,13958,0.8295619730572422,0.7791573329075508
521,a soccer player is <unk> a goal and <unk> a goal,202000824275_14110,202000824275,14110,0.8296511545426474,0.7793876422289677
522,a man is sitting in a car and smiling,202000824275_14235,202000824275,14235,0.8299503809924731,0.7800484324231446
523,a soccer game is in progress on a green field,202000824275_14398,202000824275,14398,0.8294546202434848,0.7791381950959867
524,a man in a soccer uniform is holding a soccer ball,202000824275_14517,202000824275,14517,0.8294135001892669,0.7794305687613613
525,a soccer player is kicking a ball into the goal,202000824275_14715,202000824275,14715,0.8293983617768982,0.7790417414461684
526,a soccer player is talking to a group of people,202000824275_14904,202000824275,14904,0.8293581661260119,0.7792320842806655
527,a man is driving a car and smiling,202000824275_15048,202000824275,15048,0.8299532063748785,0.7800235716837857
528,a baseball player is throwing a ball at a game,202000824275_15241,202000824275,15241,0.829404793639998,0.7790542013451582
529,a soccer player is kicking a ball into the net,202000824275_15370,202000824275,15370,0.8295619730572422,0.7791573329075508
530,a man is sitting in a car and smiling,202000824275_15492,202000824275,15492,0.8299503809924731,0.7800484324231446
531,a group of people playing a game of tennis,202000824275_15671,202000824275,15671,0.8293728578112699,0.7791775008166092
532,a man is dancing on a tennis court,202000824275_15799,202000824275,15799,0.8294672240216655,0.7796169936975423
533,a man is sitting in a car and moving his hands,202000824275_15929,202000824275,15929,0.8300203313195357,0.7799022817272131
534,a baseball player is running on the field,202000824275_16145,202000824275,16145,0.8293280768930907,0.7789615651922246
535,a man is playing a game of soccer,202000824275_16326,202000824275,16326,0.8291834364971176,0.7790381162841454
536,a baseball player is running and then slides,202000824275_16426,202000824275,16426,0.8296268418673161,0.7791508706131981
537,a group of men playing a game of soccer,202000824275_16572,202000824275,16572,0.8291683397538392,0.7790626236953958
538,a soccer player is kicking a ball into the goal,202000824275_16717,202000824275,16717,0.8293983617768982,0.7790417414461684
539,a soccer player is kicking a ball into the net,202000824275_16921,202000824275,16921,0.8295619730572422,0.7791573329075508
540,a man is playing tennis on a green court,202000824275_17147,202000824275,17147,0.8294901001389088,0.7795278572109156
541,a soccer player is <unk> a goal,202000824275_17289,202000824275,17289,0.8294473107814039,0.7791876037453521
542,a group of people are playing soccer on a field,202000824275_17490,202000824275,17490,0.8293154255768745,0.7791777798008487
543,a group of people on a field playing soccer,202000824275_17734,202000824275,17734,0.8293154255695205,0.7791777797959604
544,a man is playing tennis on a court,202000824275_17932,202000824275,17932,0.8293631872359529,0.7793531162988304
545,a baseball player is running on the field,202000824275_18082,202000824275,18082,0.8293280768930907,0.7789615651922246
546,a man is dancing and singing with a microphone,202000824275_18189,202000824275,18189,0.8298262925950042,0.7801061232170309
547,a man is kicking a soccer ball on a field,202000824275_18250,202000824275,18250,0.8294995214531855,0.7793480479832409
548,a man is holding a tennis racket and a ball,202000824275_18583,202000824275,18583,0.8297782165964346,0.7797070802769601
549,a man in a suit and tie standing in front of a sign,202000824275_19057,202000824275,19057,0.8297707616043305,0.7797518161449594
550,a man is holding a baseball bat in his hand,202000824275_19357,202000824275,19357,0.8297259745198621,0.7796941174327198
551,a man is skiing down a snowy hill,202000824275_19548,202000824275,19548,0.829858466646583,0.7800314454186054
552,a man is sitting on a bench with a skateboard,202000824275_19759,202000824275,19759,0.8299238665722295,0.7799677370957858
553,a hockey player is <unk> a goal in a game,202000824275_20020,202000824275,20020,0.8294566587910953,0.7790663467237853
554,a hockey player is <unk> a goal,202000824275_20282,202000824275,20282,0.8295010349101414,0.7791856109796299
555,a person is riding a skateboard down a ramp,202000824275_20441,202000824275,20441,0.8301608562024747,0.780161420266748
556,a hockey player is <unk> a goal,202000824275_20560,202000824275,20560,0.8295010349101414,0.7791856109796299
557,a baseball player is holding a bat while a catcher and umpire wait behind him,202000824275_20676,202000824275,20676,0.8296971348986464,0.7794208610734341
558,a hockey player is <unk> a goal,202000824275_20756,202000824275,20756,0.8295010349101414,0.7791856109796299
559,a man is skiing on a track with a crowd watching,202000824275_20884,202000824275,20884,0.8297235844887237,0.7796683129510158
560,a man in a red and white uniform is playing baseball,202000824275_20983,202000824275,20983,0.8294355443129403,0.7796625514572798
561,a group of men in red and black uniforms are standing in front of a large red and black sign,202000824275_21052,202000824275,21052,0.8296844180208648,0.77990116373673
562,a group of people riding skis down a snow covered slope,202000824275_21196,202000824275,21196,0.8299624725822378,0.779985744748608
563,a hockey player is <unk> a goal in a game,202000824275_21371,202000824275,21371,0.8294566587910953,0.7790663467237853
564,a man is snowboarding down a snowy hill,202000824275_21464,202000824275,21464,0.8299204381003931,0.7800834020111528
565,a hockey player is <unk> a goal in a game,202000824275_21577,202000824275,21577,0.8294566587910953,0.7790663467237853
566,a hockey player is <unk> a goal,202000824275_21697,202000824275,21697,0.8295010349101414,0.7791856109796299
567,a group of people riding skis down a snow covered slope,202000824275_21795,202000824275,21795,0.8299624725822378,0.779985744748608
568,a clock with a picture of a man on it,202000824275_22583,202000824275,22583,0.8300135250907148,0.7798676691327902
569,a group of men are standing in a line,202000824275_23333,202000824275,23333,0.8296004721915534,0.7795897194695208
570,a man in a suit and tie standing in front of a microphone,202000824275_23584,202000824275,23584,0.829864709833741,0.7798939353430048
571,a man is playing a guitar on stage,202000824275_23851,202000824275,23851,0.8295607875910571,0.7796174777602515
572,a man in a suit and tie sitting in a chair,202000824275_24051,202000824275,24051,0.8298392986642175,0.7799479214867987
573,a basketball player is <unk> a goal,202000824275_24263,202000824275,24263,0.8294957407696454,0.7791758129823
574,a man is dancing and singing in a room,202000824275_24365,202000824275,24365,0.8297842097136309,0.780053863657231
575,a group of people standing on a tennis court,202000824275_24441,202000824275,24441,0.8295455627907293,0.7794858651776376
576,a man holding a tennis racquet on a tennis court,202000824275_24559,202000824275,24559,0.8296443335245315,0.7796287100975084
577,a man wearing a white shirt and a tie,202000824275_24697,202000824275,24697,0.8295920806863406,0.78005335748007
578,a man is riding a bicycle and then falls off,202000824275_24820,202000824275,24820,0.8299367367714501,0.7799610723160714
579,a man holding a tennis racquet on a tennis court,202000824275_24961,202000824275,24961,0.8296443335245315,0.7796287100975084
580,a basketball player is <unk> a goal in a game,202000824275_25568,202000824275,25568,0.8294524234749596,0.7790585083255888
581,a man is talking to a crowd of people,202000824275_26188,202000824275,26188,0.829649728796388,0.7797691395089389
582,a basketball player is <unk> a goal in a game,202000824275_26374,202000824275,26374,0.8294524234749596,0.7790585083255888
583,a man is running on a field and kicking a soccer ball,202000824275_26593,202000824275,26593,0.8295849910318072,0.7793723141817818
584,a man is talking and smiling while holding a microphone,202000824275_26804,202000824275,26804,0.8299543510679066,0.7799885615368171
585,a man in a suit is looking at a computer,202000824275_26925,202000824275,26925,0.8298463036144449,0.7797807133893254
586,a man in a suit and tie holding a cellphone,202000824275_27000,202000824275,27000,0.8299107004238105,0.7799234029902138
587,a man is dancing and singing with other men,202000824275_27192,202000824275,27192,0.8295093823921641,0.7799321218325322
588,a man holding a camera in front of a mirror,202000824275_27379,202000824275,27379,0.8300434127822975,0.7798557776298166
589,a man is jumping on a stage with a microphone,202000824275_27738,202000824275,27738,0.8298824915935312,0.7798496257146409
590,a large group of people are watching a skateboarder,202000824275_28111,202000824275,28111,0.8298858401592369,0.7798079553812145
591,a man in a suit and tie standing in front of a microphone,202000824275_28367,202000824275,28367,0.829864709833741,0.7798939353430048
592,a television screen showing a man playing a video game,202000824275_28754,202000824275,28754,0.8297638839929806,0.7793494467159892
593,a tree with a clock on it in the middle of the night,202000824315_0,202000824315,0,0.8301602319663672,0.7799939894099183
594,a man is dancing and singing in a room,202000824315_18,202000824315,18,0.8297842097136309,0.780053863657231
595,a flock of birds flying through a blue sky,202000824315_236,202000824315,236,0.8301406787641503,0.78012912331727
596,a man is holding a sign that says <unk>,202000824315_642,202000824315,642,0.8299625568718595,0.7799175963035421
597,a man is holding a baseball bat in his hand,202000824315_1080,202000824315,1080,0.8297259745198621,0.7796941174327198
598,a man is dancing on stage with a microphone,202000824315_1492,202000824315,1492,0.8297594789467468,0.7799006268897257
599,a man is riding a skateboard and doing tricks,202000824315_1716,202000824315,1716,0.8299166573599153,0.7799867167281043
600,a skier is jumping a hill in the air,202000824315_1848,202000824315,1848,0.8300270397946501,0.7798531203325968
601,a man is jumping in the air on a skateboard,202000824315_1975,202000824315,1975,0.8300379695366114,0.7799839330359088
602,a man is doing a trick on a snowboard,202000824315_2049,202000824315,2049,0.8298748193489552,0.7798846133687732
603,a man riding skis down a snow covered slope,202000824315_2099,202000824315,2099,0.8300092905416027,0.7801003800802744
604,a person on skis jumping in the air,202000824315_2166,202000824315,2166,0.829999024060006,0.7799017386573148
605,a group of people riding skis down a snow covered slope,202000824315_2316,202000824315,2316,0.8299624725822378,0.779985744748608
606,a group of people riding skis down a snow covered slope,202000824315_2495,202000824315,2495,0.8299624725822378,0.779985744748608
607,a group of people riding skis on a snowy surface,202000824315_2664,202000824315,2664,0.8299213893069267,0.7799915986628916
608,a group of people standing on top of a snow covered slope,202000824315_2892,202000824315,2892,0.8299422638368542,0.7798512719305642
609,a group of people riding skis down a snow covered slope,202000824315_3131,202000824315,3131,0.8299624725822378,0.779985744748608
610,a group of people skiing down a snow covered slope,202000824315_3300,202000824315,3300,0.82998635260807,0.7799378995610285
611,a man is riding a skateboard and then falls,202000824315_3429,202000824315,3429,0.8299839333515353,0.7799984687687774
612,a man is standing in front of a bus,202000824315_3556,202000824315,3556,0.8298638071488169,0.7798669869540665
613,two men are standing together and one is talking,202000824315_3668,202000824315,3668,0.8297096681219964,0.7796329971792578
614,a group of people riding skis down a snow covered slope,202000824315_3821,202000824315,3821,0.8299624725822378,0.779985744748608
615,two men are standing together and one is talking,202000824315_3993,202000824315,3993,0.8297096681219964,0.7796329971792578
616,a person on skis is standing in the snow,202000824315_4108,202000824315,4108,0.8299101830328769,0.7799317743184201
617,two men are standing together and one is talking,202000824315_4194,202000824315,4194,0.8297096681219964,0.7796329971792578
618,a man is holding a sign and a woman is holding a pair of skis,202000824315_4364,202000824315,4364,0.8297789317281312,0.779861720310505
619,a person riding skis down a snow covered slope,202000824315_4919,202000824315,4919,0.8300748777061935,0.7801102227295155
620,a group of people on a street with a building and a traffic signal,202000824315_5407,202000824315,5407,0.8299506853702597,0.7798080930848849
621,a man is holding a snowboard in his hand,202000824315_5499,202000824315,5499,0.8299469412971991,0.7799469666517129
622,a man on a skateboard doing a trick,202000824315_5573,202000824315,5573,0.8299459493360574,0.7799641637046345
623,a group of people on a track watching a train,202000824315_5670,202000824315,5670,0.8298305143767842,0.779641037118221
624,a man is holding a snowboard in front of a crowd,202000824315_5767,202000824315,5767,0.8298028762938326,0.7798671930550274
625,a man is standing in front of a poster,202000824315_5892,202000824315,5892,0.8298788106428981,0.7799001881784775
626,a man is jumping in the air on a skateboard,202000824315_6086,202000824315,6086,0.8300379695366114,0.7799839330359088
